{
    "id": "brasck",
    "name": "Brasck",
    "location": "Se översiktsdokument på Drive",
    "area": "Corellia System",
    "persona": "Brasck är en kryddsmugglare som sitter vid samma bord som Chief Muskov och spelar kort. Synka klädseln så att den är någorlunda likadan som Chief Muskov, Brasck bär dock alltid hatt. Brasck är opålitlig och egoistisk.\nnØllan kommer vid flera tillfällen vara tvungen att lista ut vem som är Brasck och vem som är Chief Muskov. De får då ställa ja- och nej-frågor till herrarna. Brasck ljuger alltid. Muskov talar alltid sanning. Belöna gärna nØllan (t.ex. med lite extra krediter för kryddorna) som klarar att avslöja identiteterna med endast en fråga (som inte är dum nog att fråga t.ex. “Om jag frågade dig om du är Brasck, vad skulle du svara då?“).",
    "props": "Ca 12000 krediter och en kortlek som du och Chief Muskov kan spela med. ",
    "missions": [
        {
            "id": "kryddor:0",
            "comment": "Om nØllan ger dig kryddor betalar du dem med 1200 kred och signerar deras uppdragskort.",
            "response": ""
        },
        {
            "id": "kesselrun:0",
            "comment": "Denna händelse hör till Chief Muskov, men du bör känna till dem: Om nØllan ger dig nyckeln till falken ger du tillbaka den till dem och säger att deras nästa ledtråd finns på en skylt i Endor.",
            "response": ""
        }
    ],
    "events": [
        {
            "id": "negative:5",
            "comment": "Denna händelse hör till Chief Muskov, men du bör känna till dem: Om nØllan försöker muta dig för att slippa sina böter tar du bara pengarna och flinar. Gör klart för nØllan att de har gett pengar till fel person.",
            "response" : ""
        },
        {
            "id": "positive:1",
            "comment": "Denna händelse hör till Chief Muskov, men du bör känna till dem: Om nØllan berättar att de har sett Xim the Despot säger du bara att det skiter väl du i.",
            "response" : ""
        }
    ]
}
