{
    "id": "chief_muskov",
    "name": "Chief Muskov",
    "location": "Ljusgården i D",
    "area": "Corellia System",
    "persona": "Muskov är intergalaktisk polis som ständigt är på spaning efter kryddsmugglare. Han ska se ut och agera som en typisk rymdpolis när han sitter och spelar kort med Brasck.\nnØllan kommer vid flera tillfällen vara tvungen att lista ut vem som är Brasck och vem som är Chief Muskov. De får då ställa ja- och nej-frågor till herrarna. Brasck ljuger alltid. Muskov talar alltid sanning. Belöna gärna nØllan (t.ex. med lite extra krediter för kryddorna) som klarar att avslöja identiteterna med endast en fråga (som inte är dum nog att fråga t.ex. “Om jag frågade dig om du är Chief Muskov, vad skulle du svara då?“).",
    "props": "Ca 1000 kred, penna att signera händelsekort med och en kortlek. ",
    "missions": [
        {
            "id": "kryddor:0",
            "comment": "nØllan kommer för att sälja kryddorna till Brasck. Om nØllan ger dig kryddor beslagtar du dem och skäller ut dem efter noter. Gör klart för dem att de har gett kryddorna till fel person och misslyckats med uppdraget, och får börja om genom att hämta en ny kryddpåse. ",
            "response": ""
        }
    ],
    "events": [
        {
            "id": "negative:5",
            "comment": "Om nØllan försöker muta dig för att slippa sina böter förhandlar du med dem. Ett skäligt pris är ca 500 kred. När ni har kommit överens säger du: “ja, då river vi den här då” och river deras händelsekort (hahaha det kunde de ha gjort själva).",
            "response" : ""
        },
        {
            "id": "positive:1",
            "comment": "Om nØllan berättar att de har sett Xim the Despot tackar du för upplysningen, ger nØllan 200 kred och signerar händelsekortet.",
            "response" : ""
        }
    ]
}
