{
    "id": "han_solo-vakt",
    "name": "Han Solo-vakt",
    "location": "D3",
    "area": "Cryo-chamber 5 / Ice-bar - Corellia System",
    "persona": "Den som vaktar Han Solo är anställd av Jabba the Hut. Eftersom alla Jabbas polare och vänner är mutanter, slemmiga och missbildade så är det just så du ser ut. Så läbbig och konstig som möjligt. Flåsa och var äcklig.",
    "props": "Gärna något som ser ut som ett vapen! Sjukvårdskit och fylld vattenflaska, förhöjd risk för skrapsår pga podracing. Hoverboard och sparkcykel för podracing",
    "missions": [
        {
            "id": "solo:0",
            "comment": " När nØllan kommer fråga efter koden (750). Dock är ni givetvis öppen för mutor, särskilt i form av mat, och kan då tänka er att avslöja enstaka siffror i koden. När de gett dig rätt kod klagar en av er på att det är långtråkigt att vakta den nedfrysta Han Solo så nØllan måste tävla mot dig i din favoritsport podracing. Den som ska race:a tar med nØllan ut till banan på parkeringen utanför D (gå via utgången vid Örådet). Sen är det dags för podracing! När ni race:at färdigt släpper ni in nØllan i Cryo-chamber. Se till att de bara tar ett av isblocken och kolla att samma grupp inte kommer mer än en gång. Säg också att de inte får ut pappret i isblocket med våld, utan smälter blocket i ett handfat.",
            "response": "För all del, kom på något witty med att det är stentråkigt att vakta någon som är nedfryst."
        }
    ],
    "events": [
    ]
}
