{
    "id": "rebellagenten",
    "name": "Rebellagenten",
    "location": "Meta",
    "area": "Mos Eisley",
    "persona": "Du hjälper nØllan med allt de behöver och håller dig uppdaterad mot rebellbasen. Du har en rebellbasklient igång och kan tilldela grupper events. Om någon grupp ligger riktigt, riktigt illa till kan du erbjuda dem att lösa ett pussel/en gåta för immideate cash.",
    "props": "Massa krediter, ett pussel. Telefon och dator är ett måste, gärna ett coolt headset också.",
    "missions": [
        {
            "id": "luke:2",
            "comment": "Den här ledtråden ges av rebellagenten i Mos Eisley. nØllan ska anteckna sektornumret och fortsätta leta efter R2D2.",
            "response": "Jag ser att Luke sitter fast i ett skräpshakt i sektor GE2130! R2D2 kan hjälpa er rädda Luke, jag såg honom senast i baren."
            
        },
        {
            
            "id": "wmd:2",
            "comment": "Den här ledtråden ger rebellagenten i Mos Eisley muntligen om någon frågar efter »adressen till Mordor».",
            "response": "Gallandro håller till runt Roche Asteroidbälte och kanske kan sälja er en puffra, eller något mer effektivt än så…"
        }

    ],
    "events": []
}
