{
    "id": "maz_kanata",
    "name": "Maz Kanata",
    "location": "Maz Kanatas Wärdhus / Dagobah (E32)",
    "area": "Borderland Regions",
    "persona": "En orange liten skrynklig sak med jättestora glasögon. Slitna kläder i naturliga färger och ett stort leende. Hård mot Yoda som är i samma rum dock, speciellt när Yoda drygar sig mot nØllan (tar absolut ingen skit från honom). Spela dock gärna lite ledsen när du tänker på din älskade Chewie (vilket borde hända ofta i alla konversationer).",
    "props": "En högtalare.",
    "missions": [
        {
            "id": "stridsteknik:1",
            "comment": "nØllan vill att du ska lära dem en ny stridsteknik som är effektiv mot stormtroopers. Du lär dem ingenting förrän du fått se din älskade Chewbacca i karaokebaren (D2) i Corellia System.",
            "response": "“Jag lär er ingenting förrän jag får en autografbild av min älskade Chewbacca igen. Senaste gången jag såg honom var han i kareokebaren i Corellia System.“"
        },
        {
            "id": "stridsteknik:3",
            "comment": "nØllan har nu fixat en snygg och sexig autografbild av Chewbacca. Du lär nu ut den nya stridstekniken som är flossing (Backpack kid) som körs till Swish Swish (låten då alltså). Du säger även till dem att de bör prova den på en stormtrooper och ta en bild som bevis.  Glöm inte att påpeka att stridsteknikens styrka växer exponetiellt med hur många som utövar den.",
            "response": ""
        }
    ],
    "events": [
    ]
}
