{
    "id": "luke",
    "name": "Luke",
    "location": "Se översiktsdokument på Drive",
    "area": "Wild Space",
    "persona": "Luke Skywalker är en nyfiken och härlig kille som för det mesta leker jediriddare. Han är oftast glad och trevlig. Dock verkar han sitta fast med en orm runt benet djupt i något som skulle kunna vara ett sopprum fullt av vatten, men han håller humöret uppe ändå!",
    "props": "Inplastade lappar med bokstäver som bildar “Jungfru Maria”, en gosedjursorm att ha runt benet och en telefon nära till hands, 12 stycken tack-kort. ",
    "missions": [
        {
            "id": "solo:2",
            "comment": "När nØllan kommer förbi och frågar om svensexan känner du nostalgi kring den, men känner dig lite väl ledsen över att Han är borta för att kunna den där koden som nØllan vill ha till Han Solos fängelse. När nØllan ger dig en tillräckligt bra komplimang skiner du upp ger ut koden 750 samt att Boba Fett i Wild Space vet mer. Se response för ordagran replik.",
            "response": "“Åhhh svensexan, den var trevlig den. Det var då jag Bobba Fett, Jarjar Binks, Joe Biden och Han Solo avnjöt en romantisk trapetskväll under stjärnorna. Vi drack champagne, åt jordgubbar och fiskade fiskdamm på McSpace. Det var en fin dag, en mörk dag, det var den, eller vänta? Varför berättar jag detta? Jag känner mig plötsligt väldigt ledsen. Ryktena är sanna, Han (Solo) sitter inlåst i en cell skyddad med hemlig kod. Jag har dock hittat koden. Men hur ska jag kunna komma ihåg den när jag är så här ledsen? Om jag ska kunna minnas denna viktiga kod behöver jag nog uppmuntras lite. OOH Jo juste 750!. Boba fett minns kanske mer från den kvällen och kan berätta var Han försvann. Ni hittar honom i Wild Space. KOM IHÅG KODEN!!“"
        },
        {
            "id": "luke:1",
            "comment": "När nØllan kommer för att rädda dig undan ditt hemska öde (du sitter ju faktiskt fast i en soprumspress) är du väldigt tacksam.",
            "response": "Schysst att ni vill hjälpa mig! Jag verkar ha fastnat.. Bara R2D2 kan rädda mig från att dö i den här hålet. Han stänga av väggarna som rör sig mot mig om han vet vilken sektor jag är i! Ta er till hjälpcentret i Mos Eisley och be rebellagenten kolla upp sektornumret på deras övervakningskameror!"
        },
        {
            "id": "luke:0",
            "comment": "När nØllan kommer tillbaka efter att du har fått ett sms från R2D2 vakten att pressen har stoppats så är du superglad och säger att du är evigt tacksam. Sen som bevis för din tacksamhet ger du nØllan ett tack-kort. Sedan ska de ta med tack-kortet till rebellbasen för att visa att du är oskadd.",
            "response": ""
        },
        {
            "id": "leia:2",
            "comment": "När nØllan frågar om Leia berättar du att Leia lyckades lämna lite information hos R2D2, som de kan få ut om de löser koden. Du räcker fram lappar med bokstäver som nØllan ska lägga i en ordning som bildar lösenordet “Jungfru Maria”. När nØllan har knäckt koden skickar du dem vidare till R2D2 som senast sågs i Mos Eisley.",
            "response": "“Koden är 'JUNGFRU MARIA'! Ta er till R2D2, han kan hjälpa er! Senast sågs han i Mos Eisley!“"
        }
    ],
    "events": [
    ]
}
