{
    "id": "chewbacca",
    "name": "Chewbacca",
    "location": "Se översiktsdokument på Drive",
    "area": "Karaokebaren i Corellia System",
    "persona": "Chewbacca, även kallad Chewie, är hyfsat glad och lurvig 200-år gammal Wookie som är bästis med Han Solo. Han ska se riktigt hårig ut och gärna vara målad i samma stil med ansiktsfärg för att få den rätta looken. Du kommer aldrig prata riktig svenska, utan bara göra Wookie-ljud.",
    "props": "En dator att köra karaoke ifrån, 12 st pappersflygplan med serienummer på de som hör till 1000-års uppdraget, 12 st autografbilder och ett lämpligt bord för armbrytning.",
    "missions": [
        {
            "id": "1000arsservice:0",
            "comment": "Både nØllan och du har varit på jakt efter en hyperdrive motivator för att kunna reparera falken. Men svag som du är för rymdsynthar så fastnade du vid en karaokebar och blev distraherad från att ta med reservdelen till Deppo som är mekaniker. nØllan kommer till dig för att hämta reservdelen, men först måste de sjunga en duett med dig på SingStar! När ni har sjungit en låt av dignitet så får nØllan ta med sig ett av de pappersplan som finns på plats. De ska då ta med sig planet tillbaka till Deppo för att kunna avsluta uppdraget. Prata och sjung gärna så mycket du kan och var helt oförståelig när du pratar med nØllan! Till det här uppdraget borde det gå att instruera nØllan vad som ska göras med hjälp av gester och lite humor. ",
            "response": ""
        },
        {
            "id": "stridsteknik:2",
            "comment": "När nØllan kommer för att få en signerad bild på dig till Maz Kanata räcker du fram en av de signerade bilderna du har i din ägo väldigt nöjt och självsäkert.",
            "response": ""
        },
        {
            "id": "kesselrun:1",
            "comment": "När nØllan frågar om Falken informerar du dem att Han Solos vakter har tagit den och att nØllan måste besvara vaktens gåta.",
            "response": ""
        }
    ],
    "events": [
        {
            "id": "negative:9",
            "comment": "nØllan har startat en konflikt på rymd-twitter och du har utmanat de på armbrytning. Om nØllan vinner betalar de inget, om de förlorar betalar de 200 krediter. Hur mycket du vill försöka är upp till dig",
            "response": ""
        }
    ]
}
