{
    "id": "boba_fett",
    "name": "Boba Fett",
    "location": "Området mellan Arkitekt och Meta",
    "area": "Wild Space",
    "persona": "Klädd i rustning från topp till tå (Blå-grå nyanser). Han ser läskig och grym ut. Bobba är en prisjägare som alltid har sitt vapen nära till hands. Fåordig om man inte betalar för information och då är han saklig och effektiv.",
    "props": "Ca 1500 krediter och en penna att signera händelsekortet med. Utöver det ska du se fett cool ut.",
    "missions": [
        {
            "id": "1000arsservice:1",
            "comment": "nØllan behöver hjälp med att hitta en mekaniker. När din rymdmoped gick sönder nyligen fick du hjälp av mekanikern Deppo i Junkfort Station. Rekommendera honom, han verkade vara en lagom pålitlig typ.",
            "response": "Jag reparerade min rymdmoped hos mekanikern Deppo i Junkfort Station vid Nar Shaddaa."
        },
        {
            "id": "solo:3",
            "comment": "Luke har tipsat nØllan om att fråga dig när det kommer till Han Solo och/eller svensexan (som du tyckte var episk) så säger du följande:",
            "response": "“Svensexa. Juste, vi drog till Ice-bar! Jarjar och Pitbull drog hem tidigt, klena som de är. Luke hittade en riktigt snygg wookiebrud och drog hem, så det var bara jag och Han Solo kvar. Sen fastnade Han Solo med tungan på en vägg. Så jag gick hem, ingen har sett honom sedan dess. Konstigt. Ni kan hitta Ice-bar, som också går under namnet Cryochamber 5, i Corellia System.”"
        },
        {
            "id": "prisjagare:1",
            "comment": "nØllan ska ta på sig ett uppdrag som prisjägare och du är deras uppdragsgivare. När de kommer och söker dig säger du: ",
            "response": "“Jag vill att Joruus C'baoth skall röjas ur vägen. Leverera hans huvud till min kumpan i rebellbasen. Jag har hört att R2D2 vet var han befinner sig. Namnet Joruus C'baoth kanske kan väcka robotens minne till liv. R2D2 såg jag senast i baren i Mos Eisley.“"
        }
    ],
    "events": [
        {
            "id": "positive:4",
            "comment": "Sprickskytt: Om nØllan har händelsekortet prickskyttetävling ska du gratulera dem och belöna dem med 300 kred. Signera sedan kortet.",
            "response" : ""
        }
    ]
}
