{
    "id": "leias_vakter",
    "name": "Leias vakter",
    "location": "Se översiktsdokument på Drive",
    "area": "Cell 2187, Detention Block AA-23 - Borderland Regions",
    "persona": "Tvättäkta stormtroopers inklusive vapen och en ondsint attityd. Skräm gärna nØllan som springer omkring i D-huset (även om de inte är på väg till Leia) genom att stirra ut dem, smyga på dem eller följa efter dem. Men ni måste vakta dörren till Leia om någon nØllan är på väg dit. Det ligger lite kålhuvuden i närheten för ett annat uppdrag, se till att ni vet var de ligger och se till att nØllan bara tar ett per grupp -> Dessa vakter kommer att byta av med Stormtroopers lite då och då. Läs därför Stormtroopers beskrivning också! <-",
    "props": "Ett ständigt fulladdat vattengevär (som INTE får användas inomhus!).",
    "missions": [
        {
            "id": "leia:0",
            "comment": "När nØllan kommer och vill bli insläppta så nekar ni dem för att de inte är stormtroopers. Bredvid Leias cell ligger stormtroopernas omklädningsrum. Om nØllan inte fattar att de ska gå dit och klä ut sig så försök att hinta på något smart sätt. Släpp bara in dem om en nØllan har klätt ut sig, men fråga vilka de andra är så de måste hitta på något i stil med att de andra är fångar. Ni kan ju föreslå det om nØllan verkar förvirrad, det är roligare om alla får gå in i cellen!",
            "response": "För att neka: “Våra order är att bara släppa in stormtroopers, gå härifrån.”, efter att någon klätt ut sig, indikera ej utklädda nØllan: “Är det där de nya fångarna?” "
        }
    ],
    "events": [
    ]
}
