{
    "id": "obi-wan",
    "name": "Obi-Wan Kenobi",
    "location": "META",
    "area": "Mos Eisley",
    "persona": "Lång, klok gammal man. Klär sig i ökenfärgad kåpa. Gärna vitt hår och skägg. Obi Wan ska ligga ganska lågt i baren när nØllan är där. Han ska vara hemlig och nØllan måste leta upp honom. Önska nØllan lycka till och upprepa “må kraften vara med dig”. Det finns ett annat uppdrag som involverar lasersvärd (lasersvärdskuponger för att vara mer exakt), de ska prata med Big Bunji för att få rabattkuponger, inte dig.",
    "props": "En ljussabel.",
    "missions": [
        {
            "id": "jeditraning:1",
            "comment": "nØllan kommer och vill lära sin om Jedi träning/Yoda. Du ska vara tveksam att dela med information tills du blir mutad eller frågad flera gånger",
            "response": "Roboten R2D2 är en duktig navigatör och känner säkert till rymdkoordinaterna till Yodas hemplanet Dagobah. Fråga R2D2 om koordinaterna till ”Dagobah”, han sågs senast i tillsammans med ett par Jawas på Tatooine. Må kraften vara med er!"
        },
        {
            "id": "smuggelgods:1",
            "comment": "Om nØllan frågar efter smuggelgods så vill du inte ge dig det innan du fått tag i imperiets guldtackor som finns mellan Roche asteroidbälte och Corellia system.",
            "response": "Jag tog paketet i tron om att det var imperiets guldtackor, men jag hade fel. Ni måste ta hit guldtackorna innan jag ger er någonting! Jag skulle leta på mellan Roche asteroidbälte och Corellia system"
        },
        {
            "id": "smuggelgods:3",
            "comment": "När nØllan kommer tillbaka med en guldtacka (sten målad guld) säger du att du gav smuggelgodset till de gulliga Ewoksen vid Forest Moon of Endor då du inte kunde motstå dem.",
            "response": "Ge hit guldtackorna, de är inte för nybörjare!.... Tyvärr har jag alltid varit svag för Ewoker. De kom och ville ha godset, och medan deras lurviga päls förtrollade mig, så lyckades de ta det ifrån mig. Det ryktas om att Ewokerna håller hus på sin hemplanet, Endors skogsmåne."
        }
    ],
    "events": [
    ]
}
