{
    "id": "rebelledare",
    "name": "Rebelledare",
    "location": "Flygande",
    "area": "Flygande",
    "persona": "Du hjälper nØllan med allt de behöver och håller dig uppdaterad mot rebellbasen. Spring gärna runt på borggården samt E och D-husen, där fastnar många.",
    "props": "Massa krediter. Telefon och dator är ett måste, gärna ett coolt headset också.",
    "missions": [],
    "events": []
}
